{
  "$schema": "https://json-schema.org/draft/2020-12/schema",
  "$id": "urn:vietdoc:export:v1",
  "type": "object", "additionalProperties": false,
  "required": ["export_version", "document_id", "revision_id", "document_type", "schema_version", "language", "payload"],
  "properties": {
    "export_version": {"const": 1},
    "document_id": {"type": "string", "format": "uuid"},
    "revision_id": {"type": "string", "format": "uuid"},
    "document_type": {"enum": ["receipt", "invoice"]},
    "schema_version": {"enum": ["receipt.v1", "invoice.v1"]},
    "language": {"const": "vi"},
    "payload": {"$ref": "urn:vietdoc:business:v1"}
  },
  "allOf": [
    {"if": {"properties": {"document_type": {"const": "receipt"}}}, "then": {"properties": {"schema_version": {"const": "receipt.v1"}, "payload": {"$ref": "urn:vietdoc:business:v1#/$defs/Receipt"}}}},
    {"if": {"properties": {"document_type": {"const": "invoice"}}}, "then": {"properties": {"schema_version": {"const": "invoice.v1"}, "payload": {"$ref": "urn:vietdoc:business:v1#/$defs/Invoice"}}}}
  ]
}
